id,name
0,lettuce
1,french vanilla pudding and pie filling mix
2,stove top stuffing mix
3,cream cheese
4,cheddar
5,radicchio
6,pasta sauce
7,tomato sauce
8,shredded three cheese
9,mozzarella
10,cake mix
11,savory herb
12,diced tomato
13,and white chocolate swirled chocolate morsel
14,butter substitute
15,refrigerated cooked beef roast
16,refrigerated white chocolate chip macadamia nut cookie dough
17,crescent recipe creations refrigerated flaky dough sheet
18,perdue short cuts roasted carved chicken breast
19,condensed tomato soup
20,oats and honey crunchy granola bar
21,instant banana cream pudding mix
22,chocolate instant pudding and pie mix
23,sour cream and chive mashed potato
24,red wine
25,dressing
26,condensed cream of celery soup
27,cheesecake instant pudding and pie filling mix
28,olive oil
29,chocolate instant pudding and pie filling mix
30,feta cheese
31,frozen broccoli green beans onions and peppers mix
32,vanilla instant pudding and pie filling mix
33,crushed tomato
34,instant white chocolate pudding and pie filling mix
35,home s salsa
36,powdered french vanilla non-dairy coffee creamer
37,instant chocolate fudge pudding mix
38,lemonade mix
39,whole wheat pita bread
40,instant mashed potato
41,roasted garlic and red pepper spice mix
42,lawry's baja chipotle sauce
43,tomato paste
44,pastry for double crust pie
45,mushroom and green pepper spaghetti sauce
46,cream of mushroom soup
47,milk chocolate and caramel swirled morsel
48,seasoning mix
49,finely shredded four cheese
50,condensed cream of mushroom & garlic soup
51,stewed tomato
52,light cheese
53,condensed cream of chicken
54,sun-dried tomatoes packed in oil
55,baking sticks butter all-vegetable shortening
56,instant white chocolate pudding mix
57,holiday shapes and morsel
58,cheese spread
59,northwest triple berry preserve
60,candy bar
61,instant apple and cinnamon oatmeal
62,instant pudding mix
63,all-purpose baking flmy
64,trail mix
65,condensed cream of tomato soup
66,tomatoes seasoned
67,double chocolate chunk cookie mix
68,instant cheesecake pudding mix
69,lemon instant pudding and pie filling
70,white wine worcestershire sauce
71,hood calorie countdown dairy beverage
72,instant vanilla pudding and pie filling
73,frozen hash brown
74,banana cream pudding and pie filling mix
75,condensed cream of chicken soup
76,chili sauce
77,french vanilla liquid coffee creamer
78,tomato basil pasta sauce
79,ro*tel diced tomatoes & green chily
80,laughing cow light garlic and herb cheese
81,chocolate and mint swirled morsel
82,cheesecake instant pudding and pie filling
83,butter spread
84,chicken broth
85,instant butterscotch pudding mix
86,jalapeno pepper diced tomato
87,black bean
88,italian cheese and herb cooking creme
89,grillers recipe crumble
90,roasted garlic and onion spaghetti sauce
91,frozen broccoli cauliflower red sweet pepper mix
92,long grain and wild rice mix
93,old bay seasoning
94,condensed cream of mushroom soup
95,condensed cream of broccoli soup
96,home s taco dinner kit
97,soft cheese
98,cream of chicken soup
99,refrigerated flaky biscuit
100,kosher salt & ground black pepper
101,cream of broccoli soup
102,lemon frosting
103,roasted red peppers packed in oil
104,ranch dips mix
105,beef chuck shoulder pot roast
106,double crust pie crust
107,ragu parmesan and romano spaghetti sauce
108,broccoli carrots and water chestnut mix
109,unbaked deep dish pie pastry
110,instant vanilla pudding mix
111,egg beaters garden vegetable egg substitute
112,pork and beans in tomato sauce
113,tomato and basil pasta sauce
114,hines fudge brownie mix
115,mix for beef pastum
116,frozen hash brown potato
117,hazelnut nondairy liquid coffee creamer
118,cream of chicken and broccoli soup
119,self-rising corm meal mix
120,salt
121,french vanilla powdered coffee creamer
122,onion soup mix
123,nestl premier white morsel
124,black-eyed pea
125,refried bean
126,monterey jack and colby cheese
127,instant chocolate pudding mix
128,hickory and brown sugar barbecue sauce
129,chocolate bar
130,frozen bell peppers onions and celery
131,suddenly pasta salad
132,sour cream and chives potato mix
133,sweet ground chocolate and cocoa
134,onion and herb seasoning
135,parmesan asiago and romano cheese blend
136,sour cream and onion potato chip
137,shredded whole wheat cereal
138,peanut butter and milk chocolate chip
139,instant maple and brown sugar oatmeal
140,chicken meat
141,onion mushroom dry soup mix
142,pastry for a double-crust pie
143,angel hair pastum
144,orange yogurt
145,cream of chicken and mushroom soup
146,white chocolate pudding mix
147,oriental ramen noodle soup mix
148,banana cream pudding mix
149,small curd cottage cheese
150,orange spread
151,pastry crust
152,roasted red pepper and eggplant spread
153,tomato basil garlic seasoning
154,diced potato
155,jell-o chocolate pudding and pie filling
156,chopped mixed candied fruits and peel
157,refrigerated chocolate chip cookie dough
158,vanilla ice cream
159,frozen cut broccoli in cheese sauce
160,broccoli cheese soup
161,cream of celery soup
162,chicken strip
163,nestl butterscotch morsel
164,minestrone soup
165,stir-fry sauce
166,complete caesar salad in a bag
167,condensed cream of asparagus soup
168,instant pistachio pudding mix
169,individual size prebaked pizza crust
170,hungry jack big flaky refrigerated biscuit
171,broccoli and cheese rice mix
172,mild enchilada sauce
173,cheese
174,frozen corn broccoli and red pepper
175,lawry teriyaki marinade
176,solid white tuna packed in water
177,spicy black bean burger
178,tortilla
179,monterey jack pepper cheese
180,roasted garlic and sweet onion jam
181,seasoned rice vinegar
182,stove top chicken stuffing mix
183,chicken and rice soup
184,fluffy white frosting
185,alfredo
186,cinnamon streusel muffin mix
187,rum
188,garlic and herb seasoning
189,ature peanut butter cup
190,eye of round beef steak
191,light vegetable oil spread
192,sausage
193,long grain and wild rice blend
194,hamburger bun
195,pastry for double-crust deep dish pie
196,powdered non-dairy coffee creamer
197,sazon
198,graham cracker pie crust
199,fetum
200,yeast
201,frozen deep dish pie shell
202,yoplait creme caramel yogurt
203,dry infant rice cereal
204,sweetened condensed milk
205,chili paste
206,annatto
207,salt & ground black pepper
208,frozen onion and three pepper blend
209,beef and onion soup mix
210,instant coconut pudding mix
211,nestl chocolate morsel
212,french vanilla cafe instant coffee
213,sea salt & fresh black pepper
214,deep dish pie crust
215,center cut pork loin roast
216,"oranges, juice and rind of"
217,cooked whole grain brown rice
218,instant banana pudding mix
219,garlic and onion pasta sauce
220,frozen vegetable
221,dry 18 bean soup mix
222,brown and wild rice mix
223,vanilla cream-filled cookies
224,frozen crinkle cut french fry
225,beef top round steak
226,tomato
227,apricot
228,mixed nuts and dried fruit
229,beef broth
230,cream of potato soup
231,refrigerated crescent dinner roll
232,pork sirloin tip roast
233,raspberry yogurt
234,whole wheat angel hair pastum
235,shepherds pie mix
236,fine bread crumb
237,chicken stuffing mix
238,frozen broccoli
239,chocolate graham wafer pie crust
240,lite silken firm tofu
241,instant chicken bouillon granule
242,butterfly pork loin chop
243,chunky garden combination pasta sauce
244,lemon-lime powdered drink mix
245,whole almond
246,powdered drink mix
247,sun-dried tomato
248,orange drink mix
249,shredded hash brown
250,sour cream and chive dip
251,cooking spray
252,lemon & herb seasoning
253,american cheese single
254,minced fresh garlic clove
255,frozen broccoli carrots cauliflower mix
256,beef top loin steak
257,rice
258,macaroni & cheese dinner mix
259,"lime, juice and zest of"
260,dulce de leche ice cream
261,refried black bean
262,"lemons, juice and rind of"
263,instant dry milk powder
264,no yolks egg noodle substitute
265,alphabet pasta and vegetable soup
266,sweet and spicy barbecue sauce
267,honey-nut toasted oat cereal
268,creme de menthe coffee syrup
269,cherry cordial chocolate kiss
270,pineapple chunks in heavy syrup
271,alfredo sauce
272,sweet and sour sauce
273,gelatin mix
274,shrimp ramen noodle soup
275,dried hot red chili pepper
276,oven-roasted turkey breast
277,whole wheat flmy
278,duck breast half
279,mixed green and yellow bean
280,cornbread
281,pinto bean
282,meatball
283,velveeta shells and cheese dinner
284,spice blend
285,beefy mushroom soup mix
286,corn mixed
287,teddy grahams honey graham snack
288,refrigerated orange sweet roll dough
289,half & half light cream
290,vegetable seasoning
291,ro-tel diced tomato
292,grated parmesan cheese
293,ritz bits cheese cracker
294,french vanilla coffee creamer
295,complete pancake and waffle mix
296,condensed bean
297,turkey hot dog
298,chile
299,creamy ranchero tomato soup
300,fermented black bean
301,artificial sweetener
302,sweet and sour plum sauce
303,monterey jack cheese
304,cherry yogurt
305,apricot halves in light syrup
306,liver
307,"oranges, juice and zest of"
308,creme de menthe thin candy
309,"limes, juice and rind of"
310,chili bean
311,raspberry drink mix
312,french vanilla non-dairy coffee creamer
313,center cut pork chop
314,graham cracker crumb
315,breast of turkey
316,garlic and herb spaghetti sauce
317,condensed mushroom soup
318,mashed sweet potato
319,whole cranberry sauce
320,au gratin potato
321,beef short rib
322,instant coconut cream pudding mix
323,fruit cocktail in light syrup
324,instant roasted garlic mashed potato
325,ature graham cracker pie crust
326,green bean
327,cabbage and carrot coleslaw mix
328,chicken instant bouillon
329,canned spaghetti in tomato sauce
330,corn and black bean salsa
331,chicken noodle soup mix
332,whole wheat bow tie pastum
333,mayonnaise
334,pie dough
335,ground beef
336,montreal steak seasoning
337,creme de menthe baking chip
338,mandarin oranges in light syrup
339,unbaked deep-dish pie shell
340,shredded pork
341,graham cracker tart crust
342,white cranberry juice
343,cholesterol-free egg substitute
344,mint creme-filled chocolate sandwich cookies
345,instant cinnamon and spice oatmeal
346,racks of baby-back pork rib
347,fromage frai
348,cookies & cream ice cream
349,chicken in a biscuit cracker
350,frozen carrots and broccoli mix
351,sweet and sour cocktail mix
352,candy covered plain chocolate candy
353,convertedrice
354,frozen light whipped dessert topping
355,artichoke hearts packed in oil
356,real bacon bit
357,golden cream of mushroom soup
358,oreo cookie pie crust
359,mexican vegetarian ground meat substitute
360,montreal roasted garlic chicken seasoning
361,frozen passion fruit juice concentrate
362,boboli whole wheat pizza crust
363,vegetable soup
364,herb
365,hot fudge topping
366,refrigerated pizza crust
367,fruit cocktail in heavy syrup
368,french herb roasting rub
369,baked beans in tomato sauce
370,nonstick baking spray
371,velveeta cheese product
372,chocolate ice cream
373,fiber one honey clusters cereal
374,magic shell ice cream topping
375,montrealsteak seasoning
376,ragu hearty robusto pasta sauce
377,nutri flour blend
378,frozen whipped topping
379,chocolate cream-filled chocolate sandwich cookies
380,frozen cubed hash brown potato
381,chicken and herb couscous mix
382,honey roasted turkey breast
383,grands refrigerated cinnamon roll
384,frozen green bean
385,pina colada yogurt
386,strawberry gelatin
387,multi-grain hot cereal
388,spice mix
389,chocolate fudge instant pudding mix
390,cream of broccoli soup mix
391,peach slices in heavy syrup
392,pickle
393,dried mild red chili pepper
394,"orange, juice and rind of"
395,earth balance natural buttery spread
396,condensed new england clam chowder
397,mori-nu firm lite tofu
398,worcestershire sauce
399,laughing cow light swiss cheese
400,instant butter pecan pudding mix
401,black bean and rice mix
402,golden onion soup mix
403,frozen non-dairy whipped topping
404,spicy refried bean
405,sweet onion and pepper relish
406,frozen italian cut green bean
407,chicken breast half
408,hot red chili pepper flake
409,salt & fresh ground pepper
410,table blend seasoning
411,tomato bouillon
412,frozen broccoli cut
413,parma rosa sauce mix
414,fresh whole wheat bread crumb
415,tabascochipotle pepper sauce
416,cooked chicken breast
417,processed cheese
418,chocolate
419,stone ground whole wheat flmy
420,whole chicken breast
421,honey bunches of oats cereal
422,chocolate instant pudding mix
423,beef top sirloin steak
424,strawberry jell-o gelatin dessert
425,granola cereal
426,walnut half
427,chili con carne
428,jell-o instant pistachio pudding mix
429,frozen mixed vegetable
430,zucchini
431,frozen non-dairy topping
432,fudge brownie mix
433,double chocolate brownie mix
434,condensed chicken
435,french onion soup mix
436,graham cracker crust
437,cream of shrimp soup
438,sliced almond
439,diced tomatoes in tomato puree
440,garlic and herb sauce mix
441,"lemon, juice and zest of"
442,small whole wheat pasta shell
443,onion roasted garlic soup mix
444,frozen corn in butter sauce
445,chicken stock powder
446,vanilla yogurt
447,swiss miss diet cocoa mix
448,powdered cocoa mix
449,baking cocoa
450,frozen ature phyllo tart shell
451,creme-filled chocolate sandwich cookies
452,mashed potato
453,flake sweetened coconut
454,all purpose flmy
455,mint chocolate chip ice cream
456,campbell pepper jack soup
457,black and red pepper blend
458,chicken stove top stuffing mix
459,hot cocoa mix
460,ding dong chocolate snack cake
461,light chunk tuna in water
462,lean leg of lamb
463,cream of spinach soup mix
464,frozen raspberries in light syrup
465,smoked chicken breast
466,jello instant vanilla pudding mix
467,"lemons, juice and zest of"
468,"limes, juice and zest of"
469,strawberry ice cream
470,jif crunchy peanut butter
471,garlic and herb goat cheese
472,refrigerated crusty french loaf
473,chili
474,onion and mushroom soup mix
475,tony chachere's cajun spice
476,light sour cream
477,cream of chicken soup mix
478,lemon cream-filled vanilla sandwich cookies
479,yogurt
480,unsweetened powdered drink mix
481,vanilla instant breakfast drink mix
482,frozen potato and onion pierogy
483,pork loin chop
484,beefy onion soup mix
485,instant apple cider drink mix
486,country bob all purpose sauce
487,'s spicy seasoning
488,alpine lace swiss cheese
489,unbaked pastry shell
490,cooked lean ground beef
491,garlic and cheese crouton
492,vanilla pudding mix
493,strawberry banana gelatin
494,greek seasoning
495,"orange, juice and zest of"
496,condensed cream of potato soup
497,refrigerated buttermilk flaky biscuit
498,chocolate chip cookie dough
499,garlic & herb cheese
500,red potato wedge
501,caramel filled s chocolate kiss
502,apple pie filling
503,rack of baby-back pork rib
504,frozen sliced strawberries in syrup
505,garlic mashed potato
506,pina colada nonalcoholic drink mix
507,teddy grahams chocolate graham snack
508,peanut butter captain crunch cereal
509,bulls eye bold barbecue sauce
510,grands refrigerated buttermilk biscuit
511,fresh coarse ground black pepper
512,powdered orange breakfast drink mix
513,"lemon, juice and rind of"
514,split pea and ham soup
515,chocolate candy
516,morton nature seasons seasoning blend
517,french vanilla yogurt
518,taco sauce
519,pear halves in natural juice
520,apple fruit filling and topping
521,fritos chili cheese corn chip
522,whole berry cranberry sauce
523,red beans and rice mix
524,sun-dried tomato packed in oil
525,pistachio pudding mix
526,lean pork shoulder
527,unbaked pie shell
528,cottage cheese
529,canned whole cranberry sauce
530,dried baby lima bean
531,cracklin' oat bran cereal
532,chocolate-covered graham cracker cookies
533,frozen concentrated orange juice
534,country time lemonade mix
535,beef gravy
536,rotel chili fixins tomato
537,jell-o chocolate instant pudding
538,sour cream
539,chocolate nesquik powder
540,red skin white potato
541,fruit cocktail in juice
542,brown gravy mix
543,soft silken tofu
544,beef round tip steak
545,frozen cut green bean
2730,frozen grape juice concentrate
2731,hot pepper sesame oil
2732,unsweetened frozen peach slice
2733,frank's red hot sauce
2734,chocolate pudding
2735,frozen battered fish fillet
2736,whole wheat pita
2737,fresh fish fillet
2738,turkey breast
2739,white baking chocolate
2740,sirloin pork chop
2741,new england clam chowder
2742,danish dessert mix
2743,fine chocolate wafer crumb
2744,frozen yogurt
2745,dried red chili pepper
2746,unsweetened orange drink mix
2747,fresh meyer lemon juice
2748,frozen whole kernel corn
2749,sardines in tomato sauce
2750,baked bean
2751,chocolate crumb pie shell
2752,dark chocolate brownie mix
2753,jim beam bourbon whiskey
2754,large curd cottage cheese
2755,raw red bell pepper
2756,skor english toffee bit
2757,hot red chili pepper
2758,sweet tea vodka
2759,frozen small whole onion
2760,land o' lakes butter
2761,beef rib roast
2762,caramel ice cream topping
2763,french vanilla ice cream
2764,beef chuck roast
2765,peanut butter sandwich cookies
2766,lemon yogurt
2767,peanut butter
2768,instant devil's food pudding
2769,vegetable bouillon granule
2770,dried italian herb seasoning
2771,italian tomato
2772,frozen white bread dough
2773,powdered nondairy creamer
2774,dried hot red chily
2775,plum tomatoes in puree
2776,peach gelatin mix
2777,chicken bullion cube
2778,dry vegetable soup mix
2779,capers packed in salt
2780,cooked small shell pastum
2781,single trifle sponge cake
2782,vanilla whey protein powder
2783,lemon jell-o powder
2784,chocolate chip cookie mix
2785,green bell pepper flake
2786,green olives in brine
2787,unsalted sunflower seed kernel
2788,mccormick mild chili seasoning
2789,uncle bens wild rice
2790,green chili pepper flake
2791,vegetable bouillon cube
2792,mccormick broiled steak seasoning
2793,grilled chicken breast strip
2794,sliced peaches in juice
2795,whole mixed pickling spice
2796,cooked spiral shaped pastum
2797,frozen puff pastry shell
2798,dry roasted sunflower seed
2799,condensed french onion soup
2800,steak sauce
2801,sliced water chestnut
2802,canned chicken breast meat
2803,korean red pepper paste
2804,pineapple slices in juice
2805,refrigerated crescent roll
2806,vanilla wafer pie crust
2807,double cream brie cheese
2808,cherry powdered drink mix
2809,slice
2810,condensed golden mushroom soup
2811,frozen chinese pea pod
2812,sweet potato baby food
2813,powdered chocolate milk mix
2814,key lime pie yogurt
2815,fine graham cracker crumb
2816,scallion
2817,iced tea mix powder
2818,italian herb seasoning
2819,chocolate chip
2820,strawberry jam
2821,french fried onions ring
2822,italian cheese blend
2823,whole wheat english muffin
2824,american cheese slice
2825,canned whole kernel corn
2826,sugar cookie mix
2827,baby back rib rack
2828,whole wheat bread crumb
2829,cinnamon graham cracker
2830,dried black turtle bean
2831,instant tapioca pudding mix
2832,fresh ground white pepper
2833,acini di pepe pastum
2834,beef bouillon granule
2835,ruby red grapefruit juice
2836,raspberry-cranberry frozen juice concentrate
2837,baker's unsweetened chocolate square
2838,liquid egg product
2839,onion and garlic powder
2840,dried chili pepper flake
2841,any desired food coloring
2842,vegetable broth
2843,beef stroganoff sauce mix
2844,mint herbal tea bag
2845,light monterey jack cheese
2846,peas and pearl onion
2847,crushed tomatoes in puree
2848,bisquick heart smart mix
2849,bisquick baking mix
2850,duck breast
2851,raw shrimp
2852,pastry for double-crust pie
2853,cooked whole wheat noodle
2854,chessmen cookies
2855,full size snickers bar
2856,angostura worcestershire sauce
2857,frozen pink lemonade concentrate
2858,frozen pina colada mix
2859,open pit barbecue sauce
2860,lean ground beef
2861,chicken breast fillet
2862,dill dip
2863,coarse kosher salt
2864,smoked turkey breast
2865,bleached all purpose flmy
2866,pork roast
2867,whole wheat hamburger bun
2868,grey poupon dijon mustard
2869,chocolate milk
2870,buffalo wings seasoning blend
2871,bottom round roast
2872,unsweetened drink mix
2873,chevre cheese
2874,cranberry almond crunch cereal
2875,white chocolate baking bar
2876,red wine vinaigrette
2877,whole wheat dinner roll
2878,half and half milk
2879,frozen peas and carrot
2880,milk chocolate
2881,dried wood ear mushroom
2882,cut yams in syrup
2883,sweet whole kernel corn
2884,dry milk solid
2885,hollandaise mix
2886,atlantic salmon fillet
2887,unsalted creamy peanut butter
2888,pineapple tidbits in syrup
2889,frozen cranberry juice concentrate
2890,honey ham deli meat
2891,pears in heavy syrup
2892,dried whole dill weed
2893,butter pecan ice cream
2894,cinnamon apple tea bag
2895,deep dish pie shell
2896,strawberry frozen yogurt
2897,"navel orange, juice of"
2898,vanilla frozen yogurt
2899,dry whole grain breadcrumb
2900,fruit cocktail in syrup
2901,salmon fillet
2902,frozen strawberry daiquiri concentrate
2903,peach halves in syrup
2904,frozen french-cut green bean
2905,garlic and herb-seasoned breadcrumb
2906,fat ricotta cheese
2907,chicken piece
2908,grey poupon honey mustard
2909,caramel irish cream
2910,crisp chow mein noodle
2911,gold medal all-purpose flmy
2912,juices from cooked meat
2913,rock cornish game hen
2914,chocolate baking square
2915,irish cream
2916,masterpiece barbecue sauce
2917,brown sugar baked bean
2918,tomato base barbecue sauce
2919,whole grain wheat flmy
2920,hot spiced cider mix
2921,orange pekoe tea bag
2922,whole wheat bread
2923,garlic and herb butter
2924,spaghetti sauce
2925,sunny delight orange drink
2926,lawry baja chipotle marinade
2927,vegan egg replacer powder
2928,coffee yogurt
2929,instant mocha coffee powder
2930,whole wheat pasta shell
2931,pork loin steak
2932,sweet potatoes in syrup
2933,tuna packed in oil
2934,long grain white rice
2935,round loaf italian bread
2936,tarragon white wine vinegar
2937,cooked whole wheat spaghettus
2938,pineapple slices in syrup
2939,soy sauce
2940,frozen peppers and onion
2941,creamy peanut butter
2942,dry northern white bean
2943,sweet red pepper relish
2944,tomato sauce & mushroom
2945,garlic red wine vinegar
2946,bottled hot pepper sauce
2947,unsweetened vanilla almond milk
2948,egg substitute
2949,pork rib
2950,chunky peanut butter
2951,mrs richardson's caramel topping
2952,chocolate pudding mix
2953,sweet and sour soda
2954,whole wheat french bread
2955,processed cheese slice
2956,chocolate liqueur
2957,pie shell
2958,peach slices in syrup
2959,skim milk ricotta cheese
2960,unsweetened crushed canned pineapple
2961,pears in light syrup
2962,coffee ice cream
2963,lean ground pork
2964,oat bran hot cereal
2965,whole wheat bread cube
2966,fried rice
2967,ground red chili pepper
2968,whole wheat pizza crust
2969,granola
2970,dry roasted salted peanut
2971,frozen puff pastry
2972,strawberry kiwi gelatin powder
2973,honey graham cracker
2974,new york strip steak
2975,chocolate and mint cookies
2976,corn on the cob
2977,hot chinese chili paste
2978,thai red curry paste
2979,chinese white rice vinegar
2980,cilantro leaves and stem
2981,light whole wheat bread
2982,liquid hot pepper sauce
2983,baked tofu
2984,seasoned rice wine vinegar
2985,green peppercorns in brine
2986,fat cottage cheese
2987,salt and fresh pepper
2988,black bean garlic sauce
2989,short rib of beef
2990,sazon con azafran seasoning
2991,pork spare rib rack
2992,whole grain dijon mustard
2993,rice pilaf
2994,top loin pork chop
2995,dried split green pea
2996,sweetened lemonade drink mix
2997,au gratin potato mix
2998,canned cherry pie filling
2999,cream of tomato soup
3000,chicken cutlet
3001,cooked angel hair pastum
3002,instant tang orange drink
3003,nacho cheese dorito
3004,green food coloring paste
3005,simply macaroni & cheese
3006,sesame and ginger marinade
3007,kidney bean
3008,cream of asparagus soup
3009,t-bone type lamb chop
3010,cooked long-grain brown rice
3011,liquid crab boil concentrate
3012,stone ground dijon mustard
3013,pineapple tidbits in juice
3014,cherry vanilla yogurt
3015,frozen strawberries in syrup
3016,fajita chicken strip
3017,full cream milk powder
3018,hormel real bacon bit
3019,ranch dip
3020,dried small red chily
3021,chocolate syrup
3022,dried salt cod fish
3023,dove dark chocolate ature
3024,velveeta pepper jack cheese
3025,whole wheat lasagna noodle
3026,white lily self-rising flmy
3027,fresh pork loin roast
3028,salad supreme dry seasoning
3029,swirled holiday morsel
3030,peanut butter cup ature
3031,unbaked double pie crust
3032,cheeseburger macaroni
3033,frozen shredded hash brown
3034,shredded hash brown potato
3035,converted long grain rice
3036,white creme de cacao
3037,frozen sugar snap pea
3038,whole grain english muffin
3039,oriental instant ramen noodle
3040,chocolate-covered peanut butter cup
3041,frozen tart shell
3042,banana cream instant pudding
3043,cooked chicken breast half
3044,potato & cheese pierogy
3045,jumbo lump crab meat
3046,orange breakfast drink mix
3047,orange sweet bell pepper
3048,frozen baby lima bean
3049,ature party rye round
3050,milk chocolate liqueur
3051,red bird's eye chili
3052,dry curd cottage cheese
3053,beef bouillon powder
3054,all-bran cereal
3055,boboli thin pizza shell
3056,cooked bow tie pastum
3057,whole wheat flat bread
3058,rice flour mix
3059,green creme de menthe
3060,brummel and brown spread
3061,firm silken tofu
3062,refrigerated sugar cookie dough
3063,beef round steak
3064,whole grain oat flmy
3065,dry crushed red pepper
3066,chocolate-covered english toffee bar
3067,vegetarian chicken bouillon cube
3068,soup bone
3069,baby sweet corn cob
3070,canned spaghetti and sauce
3071,ruby red grapefruit vodka
3072,lightly sweetened whipped cream
3073,eaglecondensed milk
3074,ature almond joy bar
3075,dark creme de cacao
3076,beef chuck steak
3077,heads of cabbage
3078,artichoke hearts in brine
3079,garlic powder
3080,your favorite barbecue rub
3081,sloppy joe sandwich sauce
3082,crispy brown rice cereal
3083,chocolate wafer pie crust
3084,long grain brown rice
3085,crunchy cheetos cheese snack
3086,butterflied leg of lamb
3087,lemon sorbet
3088,lemon pie filling mix
